{
  "version": "0.1",
  "source": {"kind": "first-party", "version": "0.14.0", "license": "MIT", "catalog_path": "data/cases.json"},
  "taxonomy": {
    "categories": ["Characters & People", "Charts & Infographics", "Posters & Typography", "Products & E-commerce"],
    "styles": ["Character", "Documentary", "Editorial", "Fashion", "Illustration", "Infographic", "Motion", "Photography", "Poster", "Product", "Realistic", "Technical"],
    "scenes": ["Commerce", "Creative", "Fashion", "Interior", "Story", "Tech", "Urban"]
  },
  "summary": {"record_count": 16, "approved_count": 16},
  "cases": [
    {
      "id": 1,
      "title": "AURORA MINI Product Commerce Visual",
      "category": "Products & E-commerce",
      "styles": ["Product", "Photography", "Realistic"],
      "scenes": ["Commerce", "Tech"],
      "featured": true,
      "selection_text": "Premium 16:9 product launch visual with one clear acrylic cube device, one circular display, one matte-black base, large negative copy space, exact short labels, thin semantic callout lines, believable refraction, controlled reflections, soft studio light, and restrained graphite ivory amber color.",
      "prompt_path": "gallery/prompts/product-commerce-visual-aurora-mini.md",
      "prompt_sha256": "83693dd7b4a1f530abb690451c8885d4a6a826a6b89876061680358153f552fc",
      "image": {"path": "gallery/images/product-commerce-visual-aurora-mini.png", "alt": "AURORA MINI product commerce visual"},
      "status": "approved_public_gallery"
    },
    {
      "id": 2,
      "title": "MARA VENN Character Design Sheet",
      "category": "Characters & People",
      "styles": ["Character", "Illustration"],
      "scenes": ["Creative", "Story"],
      "featured": true,
      "selection_text": "Professional 16:9 character production sheet with one original adult character, a large three-quarter hero pose, consistent front side back turnarounds, expression studies, equipment details, color swatches, warm off-white editorial grid, exact minimal labels, locked face hair scar outfit and left-right identity anchors.",
      "prompt_path": "gallery/prompts/character-design-sheet-mara-venn.md",
      "prompt_sha256": "f341ab2ceaf630e907158993807f4f2bd7ccb2c1ef754a877eeae8a0602dea63",
      "image": {"path": "gallery/images/character-design-sheet-mara-venn.png", "alt": "MARA VENN character design sheet"},
      "status": "approved_public_gallery"
    },
    {
      "id": 3,
      "title": "MARA VENN Realistic Photography",
      "category": "Characters & People",
      "styles": ["Character", "Photography", "Realistic"],
      "scenes": ["Creative", "Story"],
      "featured": true,
      "selection_text": "Natural documentary environmental portrait of one original adult field professional at a sparse desert communications outpost, preserved fictional identity and wardrobe, eye-level 50 mm perspective, soft sunrise light, realistic skin and material wear, visible anatomically correct hands, restrained cinematic grade, and no text.",
      "prompt_path": "gallery/prompts/realistic-photography-mara-venn.md",
      "prompt_sha256": "a9f3638bbece7471a946a9a5c4e87cbf80a5b14d8a12ad8f41aad0c2942100e6",
      "image": {"path": "gallery/images/realistic-photography-mara-venn.png", "alt": "MARA VENN realistic environmental portrait"},
      "status": "approved_public_gallery"
    },
    {
      "id": 4,
      "title": "NOA REYES Realistic Fashion Lookbook",
      "category": "Characters & People",
      "styles": ["Photography", "Realistic", "Fashion"],
      "scenes": ["Fashion", "Commerce"],
      "featured": true,
      "selection_text": "Photorealistic 4:5 fashion contact sheet with exactly six full-body appearances of one original adult identity, a clean 2-column by 3-row grid, equal scale and floor alignment, six distinct practical wardrobe capsules, authentic skin and fabric, complete hands and shoes, restrained studio light, and no visible text or brands.",
      "prompt_path": "gallery/prompts/realistic-fashion-lookbook-noa-reyes.md",
      "prompt_sha256": "f1e58cf74f4176aa1c81569359c6731648e6a9765401e6272b0d0f1774d90bc9",
      "image": {"path": "gallery/images/realistic-fashion-lookbook-noa-reyes.png", "alt": "NOA REYES realistic six-look fashion lookbook"},
      "status": "approved_public_gallery"
    },
    {
      "id": 5,
      "title": "ORBITAL FRAME ONE Exploded Product Diagram",
      "category": "Products & E-commerce",
      "styles": ["Product", "Realistic", "Technical"],
      "scenes": ["Commerce", "Tech"],
      "featured": true,
      "selection_text": "Photorealistic 4:5 exploded product diagram of one original wearable work visor with nine coherent functional layers, centered axial alignment, plausible material and assembly logic, dual optics, symmetric battery modules, complete parts, generous studio spacing, and no visible text or brands.",
      "prompt_path": "gallery/prompts/exploded-product-diagram-orbital-frame-one.md",
      "prompt_sha256": "6ec712b48813d3d56611bccefa720de5e3569fb75bd86250256d150fd66ebe8e",
      "image": {"path": "gallery/images/exploded-product-diagram-orbital-frame-one.png", "alt": "ORBITAL FRAME ONE exploded product diagram"},
      "status": "approved_public_gallery"
    },
    {
      "id": 6,
      "title": "MIRA KANG Quiet Editorial Portrait",
      "category": "Characters & People",
      "styles": ["Photography", "Realistic", "Editorial"],
      "scenes": ["Creative", "Interior"],
      "featured": true,
      "selection_text": "Photorealistic 9:16 quiet indoor editorial portrait of one original adult person seated naturally against a textured plaster wall, modest knit and overshirt layers, complete hands and lower-body context, soft window side light, restrained grain, off-camera gaze, generous negative space, and no sexualized styling or text.",
      "prompt_path": "gallery/prompts/quiet-editorial-portrait-mira-kang.md",
      "prompt_sha256": "019864f7f5236392193cd72593790c0548394864fffff3a5bb343e26aeb2fd02",
      "image": {"path": "gallery/images/quiet-editorial-portrait-mira-kang.png", "alt": "MIRA KANG quiet editorial portrait"},
      "status": "approved_public_gallery"
    },
    {
      "id": 7,
      "title": "LEO NAVARRO Realistic Motion Editorial",
      "category": "Characters & People",
      "styles": ["Photography", "Realistic", "Editorial", "Motion"],
      "scenes": ["Creative", "Urban"],
      "featured": true,
      "selection_text": "Photorealistic vertical full-body motion editorial of one fictional adult dancer in a physically credible grounded mid-step, complete hands and shoes, modest unbranded workwear, rain-darkened concrete, soft blue-hour skylight, a subtle warm reflection, natural skin and fabric texture, and no text or brands.",
      "prompt_path": "gallery/prompts/realistic-motion-editorial-leo-navarro.md",
      "prompt_sha256": "e72ba9918352ab6ea445bc739b5ebe7062469d243181b5af07fd354a4582fb54",
      "image": {"path": "gallery/images/realistic-motion-editorial-leo-navarro.png", "alt": "LEO NAVARRO realistic full-body motion editorial"},
      "status": "approved_public_gallery"
    },
    {
      "id": 8,
      "title": "ANIKA ROWAN Documentary Craft Portrait",
      "category": "Characters & People",
      "styles": ["Photography", "Realistic", "Documentary"],
      "scenes": ["Creative", "Interior"],
      "featured": true,
      "selection_text": "Photorealistic vertical documentary craft portrait of one fictional adult ceramic artist shaping one small clay bowl at a potter's wheel, complete hands and fingers, full seated body and shoes, modest unbranded workwear, damp clay, used workshop material, soft window daylight, and no text or brands.",
      "prompt_path": "gallery/prompts/documentary-craft-portrait-anika-rowan.md",
      "prompt_sha256": "810491bb52aeaf957d3c066a1a7b104459736416288ec7ff0725981b179634bd",
      "image": {"path": "gallery/images/documentary-craft-portrait-anika-rowan.png", "alt": "ANIKA ROWAN documentary craft portrait"},
      "status": "approved_public_gallery"
    },
    {
      "id": 9,
      "title": "ELISE MOREAU Documentary Music Rehearsal",
      "category": "Characters & People",
      "styles": ["Photography", "Realistic", "Documentary"],
      "scenes": ["Creative", "Interior"],
      "featured": true,
      "selection_text": "Photorealistic vertical documentary rehearsal portrait of one fictional adult cellist with one complete full-size cello and one bow, complete hands and shoes, credible instrument structure and scale, modest unbranded clothing, soft window daylight, natural wood and wool texture, and no text or brands.",
      "prompt_path": "gallery/prompts/documentary-music-rehearsal-elise-moreau.md",
      "prompt_sha256": "9790b3a2f9f527278557afdc87edd9869c0e738d73c9ab7a89096c04b4e4dc3e",
      "image": {"path": "gallery/images/documentary-music-rehearsal-elise-moreau.png", "alt": "ELISE MOREAU documentary music rehearsal"},
      "status": "approved_public_gallery"
    },
    {
      "id": 10,
      "title": "NORA VALE Mature Documentary Portrait",
      "category": "Characters & People",
      "styles": ["Photography", "Realistic", "Documentary"],
      "scenes": ["Story", "Travel"],
      "featured": true,
      "selection_text": "Photorealistic vertical mature environmental documentary portrait of one fictional 62-year-old coastal ecologist, natural fine lines and gray hair, complete standing body, both coherent hands touching one timber rail and one closed notebook, modest unbranded field clothing, rain-damp salt-marsh boardwalk, reeds, soft overcast daylight, and no text or brands.",
      "prompt_path": "gallery/prompts/mature-documentary-portrait-nora-vale.md",
      "prompt_sha256": "402290255bb7227c49b8d5915ba1f9337d4d3bb9eca0b5e22f7802fae218bc47",
      "image": {"path": "gallery/images/mature-documentary-portrait-nora-vale.png", "alt": "NORA VALE mature documentary portrait"},
      "status": "approved_public_gallery"
    },
    {